ID,D_ID,U_ID,Speaker,Utterance,Emotion,Label
1475,108,12,Ross,Later is not good enough.,anger,1
1476,108,13,Ross,Ask again later.,neutral,1
1477,108,14,Ross,What the hell!,anger,0
1478,108,15,Ross,This is broken!,anger,1
1479,108,16,Ross,It-it is broken!,anger,1
1480,108,17,Monica,"All right, let me see.  Will Chandler have sex tonight?  Don't count on it. Seems like it works to me.",neutral,1
1481,109,0,Phoebe,"I think she took it pretty well. You know Paolo's over there right now, so...",neutral,0
1482,109,1,Ross,"Ah...ooh! Well, looks like, uh, we kicked your butts.",joy,0
1483,109,2,Joey,"No-no, she kicked our butts. You could be on the Olympic standing-there team.",anger,1
1484,109,3,Ross,"Come on, two on one.",neutral,0
1485,109,4,Chandler,"What are you still doing here? She just broke up with the guy, it's time for you to swoop in!",surprise,0
1486,109,5,Ross,"What, now?",surprise,1
1487,109,6,Joey,"Yes, now is when you swoop!",joy,0
1488,109,7,Joey,"You gotta make sure that when Paolo walks out of there, the first guy Rachel sees is you, She's gotta know that you're everything he's not!",joy,0
1489,109,8,Joey,"You're like, like the anti-Paolo!",anger,0
1490,109,9,Chandler,My Catholic friend is right.,neutral,1
1491,109,10,Chandler,She's distraught.,neutral,0
1492,109,11,Chandler,You're there for her.,neutral,0
1493,109,12,Chandler,"You pick up the pieces, and then you usher in the age of Ross!",joy,1
1494,110,0,Rachel,"Well, I just called Joshua",neutral,0
1495,110,1,Phoebe,"Oh, how did it go?",sadness,0
1496,110,2,Rachel,"Well, I did my best to convince him that I’m not some crazy girl who is dying to get married—I’m just going through a hard time.",neutral,0
1497,110,3,Phoebe,What did he say?,neutral,0
1498,110,4,Rachel,"Well uh, his answering machine was",sadness,1
1499,110,5,Monica,"Ohh, sweetie!  Hey, I bet you anything that he’s gonna call you again.",sadness,0
1500,110,6,Rachel,"Yeah, maybe, but I don’t think I even care.",sadness,0
1501,110,7,Rachel,I don’t think he’s the one I’m sad about.,sadness,0
1502,110,8,Rachel,"Y’know, I know that I said that I am totally okay with Ross getting married, but as it turns out, I don’t think I’m handling it all that well.",sadness,0
1503,110,9,Phoebe,"Yeah, maybe.",sadness,0
1504,110,10,Rachel,And I-I am just trying to figure out why.,sadness,0
1505,110,11,Phoebe,Any luck?,sadness,0
1506,110,12,Rachel,"Well, yeah, y’know how Ross and I were on again, off again, on again, off again?",sadness,0
1507,110,13,Rachel,"I guess I just figured that somewhere down the road, we would be on again.",sadness,0
1508,110,14,Monica,Again. Y’know what? I think we all did.,sadness,0
1509,110,15,Ross,Hey!,joy,0
1510,111,0,Joey,"This is the unit for you my friend. Sturdy construction, tons of storage compartments, some big enough to fit a grown man.",neutral,1
1511,111,1,Guy,What?!,surprise,0
1512,111,2,Joey,Oh yeah!,joy,0
1513,111,3,Joey,I got in there myself once.,neutral,1
1514,111,4,Joey,"My roommate bet me five bucks that I couldn’t, and then he stuck a board through the handles that locked me in.",neutral,1
1515,111,5,Joey,Yeah.,neutral,0
1516,111,6,Joey,It was funny ‘til I started feeling like I was in a coffin.,neutral,0
1517,111,7,Guy,"No, you, you can’t fit in that thing. That’s not deep enough.",neutral,0
1518,111,8,Joey,"Oh yeah?  If I can’t, I’ll knock five bucks off the price off the unit.",anger,0
1519,111,9,Guy,"All right, you have yourself a deal.",neutral,0
1520,111,10,Joey,Okay.  See?! I told ya!,surprise,1
1521,111,11,Joey,"Sometimes I get in here just to get away from it! Hey, a nickel!!",anger,1
1522,112,0,Joey,Hey! What’s up?,neutral,0
1523,112,1,Rachel,Hey!,joy,0
1524,112,2,Joey,"Hey-hey, who’s your friend?  Hey!!",joy,1
1525,112,3,Erin,Hey Joey!,joy,0
1526,112,4,Joey,Erin! Still here!,joy,1
1527,112,5,Rachel,"Yeah, we ended up spending the day together and had such a great time!",joy,0
1528,112,6,Joey,Why wouldn’t ya? Erin is great! Then-then there’s you guys.,joy,1
1529,112,7,Erin,"Ohh, listen. I’ve got to get going. Today was great, thanks!",joy,0
1530,113,0,Bonnie,I think I brought back half of the beach in my hair. It was so much easier when I used to shave my head.,anger,0
1531,113,1,Rachel,"Y'know, I gotta tell ya, I just",neutral,0
1532,113,2,Bonnie,Really?!,surprise,0
1533,113,3,Rachel,Ohh!,surprise,0
1534,113,4,Bonnie,Because I think about shaving it all off again sometime.,neutral,0
1535,113,5,Rachel,Really?!,surprise,0
1536,113,6,Bonnie,Yeah!,joy,0
1537,113,7,Rachel,I mean you definitely should do that.,neutral,0
1538,113,8,Bonnie,"Y'know what, I should do it.",joy,0
1539,113,9,Rachel,Yeah!,joy,0
1540,113,10,Bonnie,"Yeah, thank you Rachel, you are soo cool.",joy,0
1541,113,11,Rachel,"Awww, stop. Come on. Now go shave that head!",neutral,1
1542,113,12,Bonnie,All right.,neutral,0
1543,114,0,Rachel,"Oh, Monica. You are not still going over that thing.",sadness,0
1544,114,1,Monica,This woman's living my life.,anger,0
1545,114,2,Rachel,What?,surprise,0
1546,114,3,Monica,"She's living my life, and she's doing it better than me!",anger,1
1547,114,4,Monica,"Look at this, look.",anger,0
1548,114,5,Monica,She buys tickets for plays that I wanna see.,anger,0
1549,114,6,Monica,"She, she buys clothes from stores that I'm intimidated by the sales people.",anger,0
1550,114,7,Monica,She spent three hundred dollars on art supplies.,anger,0
1551,114,8,Rachel,You're not an artist.,neutral,0
1552,114,9,Monica,"Yeah, well I might be if I had the supplies! I mean, I could do all this stuff. Only I don't.",anger,1
1553,115,0,Chandler,I can't believe you would actually say that. I would much rather be Mr.Peanut than Mr.Salty.,surprise,1
1554,115,1,Joey,"No way! Mr.Salty is a sailor, all right, he's got to be, like, thetoughest snack there is.",anger,1
1555,115,2,Ross,"I don't know, you don't wanna mess with corn nuts. They're craaazy.",neutral,1
1556,115,3,Monica,Oh my God. You guys! You gotta come see this! There's some creep out there with a telescope!,fear,0
1557,115,4,Ross,I can't believe it! He's looking right at us!,surprise,0
1558,115,5,Rachel,"Oh, that is so sick.",disgust,0
1559,115,6,Chandler,I feel violated. And not in a good way.,disgust,1
1560,115,7,Phoebe,"How can people do that?...  Oh, you guys, look! Ugly Naked Guy got gravity boots!",surprise,1
1561,116,0,Joey,Hey.,neutral,0
1562,116,1,Joey,I just saw a woman breast feeding both of her twins at the same time. it is like a freak show up here.,neutral,1
1563,116,2,Joey,What’s the matter?,neutral,0
1564,116,3,Rachel,Nothing.,neutral,0
1565,116,4,Joey,What is it? Hey!,sadness,0
1566,116,5,Rachel,Really it’s nothing. I’m just,sadness,0
1567,116,6,Joey,"Rach come on, what?",neutral,0
1568,116,7,Rachel,I’ve just been thinking about how my baby and I are gonna be all alone.,sadness,0
1569,116,8,Joey,What are you talking about alone? What about Ross?,surprise,0
1570,116,9,Rachel,"Oh please, he’ll be with his real family, the twins and little miss new boobs.",sadness,0
1571,116,10,Joey,"Okay, how long was I watching that woman?",neutral,1
1572,116,11,Rachel,"I’m just saying that y’know, someday Ross is gonna meet somebody and…he’s gonna have his own life. Right?",sadness,0
1573,116,12,Joey,"Yeah, I guess so.",neutral,0
1574,116,13,Rachel,I just never thought I would raise this baby all by myself. Pretty dumb huh?,sadness,0
1575,117,0,Monica,"Chandler, we said we would meet at the coffeehouse at six.",anger,0
1576,117,1,Chandler,We said seven!,anger,0
1577,117,2,Monica,We said six!,anger,0
1578,117,3,Chandler,"The only way that I said six would be if the seven’s, let meet at seven, not at six.",neutral,1
1579,117,4,Monica,"Yeah and if I had seven, maybe I would’ve said something like this, ""Wow! My boyfriend’s such a wise ass—seven!""",anger,1
1580,117,5,Phoebe,Hi!,joy,0
1581,117,6,Chandler,Oh my good God.,disgust,0
1582,117,7,Phoebe,I know what time you said.,joy,1
1583,117,8,Chandler,What?!,surprise,0
1584,117,9,Phoebe,"Well actually, I know what time Chester and Marcia said.",neutral,1
1585,118,0,The Dry Cleaner,"You, get out of my shop!",anger,0
1586,118,1,Phoebe,"Well, what did he do?",surprise,0
1587,118,2,The Dry Cleaner,He went out with my wife!,anger,1
1588,118,3,Phoebe,Joey!,surprise,0
1589,118,4,Joey,"Whoa-whoa-whoa-whoa, I-I—Hey! I did",anger,0
1590,118,5,The Dry Cleaner,That’s my wife!!! Get out!,anger,1
1591,118,6,Phoebe,"Well, we should go.",neutral,0
1592,118,7,Joey,Yeah.,neutral,0
1593,119,0,Chandler,"No, I’m afraid I won’t be able to make love as well as him.",anger,1
1594,119,1,Ross,"Yeah, I was going for the metaphor.",neutral,0
1595,119,2,Chandler,"Yes, and I was saying the actual words.",neutral,1
1596,119,3,Monica,"So big deal, so Joey’s had a lot of girlfriends, it doesn’t mean he’s great in bed.",neutral,0
1597,119,4,Chandler,"We share a wall! So either he’s great in bed, or she just likes to agree with him a lot.",neutral,1
1598,119,5,Monica,"Sweetie, with you it’s gonna be different. The sex is gonna be great, ‘cause you-you guys are in love.",joy,0
1599,119,6,Chandler,Yeah?,surprise,0
1600,119,7,Rachel,Yeah!,joy,0
1601,119,8,Ross,Just go for it Chandler.,neutral,0
1602,119,9,Monica,"Yeah, you should.",neutral,0
1603,119,10,Rachel,"Yeah, you should, really.",neutral,0
1604,119,11,Chandler,"All right, all right, I’ll go sleep with my girlfriend. But I’m just doing it for you guys.",neutral,1
1605,120,0,Mr. Treeger,": I’m sure as hell a dancer, it’s no use Marge will never go for me.",sadness,0
1606,120,1,Joey,"Come on Treeger, don’t say that.",sadness,0
1607,120,2,Joey,"You just ahh, you just need more practice.",neutral,0
1608,120,3,Joey,"Here, come on, let’s ahh, let’s try it again.",neutral,0
1609,120,4,Joey,"Plus, it was, it was probably mostly my fault, anyway.",sadness,0
1610,120,5,Joey,"I mean, y’know, I’m not really that comfortable dancing with a— We-he!!",joy,1
1611,120,6,Joey,Hey!,joy,0
1612,120,7,Mr. Treeger,: Yeah!,joy,0
1613,121,0,Phoebe,Are you sure? I’ll bet there’s another flight to Minsk in like,neutral,0
1614,121,1,David,"July. Umm,",neutral,0
1615,121,2,Phoebe,That’s really beautiful. What does it mean?,joy,0
1616,121,3,David,"Please, clean my beakers. I don’t get out of the lab much.",neutral,1
1617,121,4,Phoebe,"That’s good. I got to admit, I thought it was something else.",joy,0
1618,121,5,David,"Yeah, I… Well I really actually wanted to say umm, that, but um, I figured I probably shouldn’t because y’know, I…have to leave.",neutral,0
1619,121,6,Phoebe,You’re right! You’re right. Don’t say it.,sadness,0
1620,121,7,David,I-I do though.,sadness,0
1621,121,8,Phoebe,I do too.,sadness,0
1622,121,9,David,Bye Phoebe.,neutral,0
1623,121,10,Phoebe,"Okay, now’s not the time Joey. All right? You can yell at me tomorrow.",sadness,0
1624,122,0,Rachel,Ohhh!,surprise,0
1625,122,1,Ross,Why are we in bed together?,surprise,1
1626,122,2,Rachel,I don’t know. Do-do you have any clothes on?,neutral,1
1627,122,3,Ross,Yeah.,neutral,0
1628,122,4,Rachel,Really?!,surprise,0
1629,122,5,Ross,No!,neutral,0
1630,122,6,Ross,"But we-we didn’t have…sex-uh, did we?",fear,0
1631,122,7,Ross,"I mean, I don’t remember much about last night, it was such a blur.",neutral,0
1632,122,8,Rachel,Oh! I remember laughing! I laughed a lot.,joy,0
1633,122,9,Ross,And we didn’t have sex.,neutral,0
1634,122,10,Rachel,"Ohh, I mean, we were really drunk. I’m just glad we didn’t do anything stupid.",neutral,0
1635,122,11,Ross,Tell me about it.,neutral,0
1636,123,0,Rachel,"Hey, Mon, if you were hoping to sleep with Joshua the first time tonight, which one of these would you want to be wearing.",neutral,1
1637,123,1,Monica,Y’know what? It,neutral,0
1638,123,2,Rachel,Sorry.,neutral,0
1639,123,3,Rachel,I’m so exited!,joy,0
1640,123,4,Rachel,I’ve been waiting for this for months!,joy,0
1641,123,5,Rachel,I got my hair coloured!,joy,0
1642,123,6,Rachel,I got new sheets!,joy,0
1643,123,7,Rachel,I’m making him a,joy,0
1644,123,8,Rachel,What am I making him by the way?,neutral,1
1645,123,9,Monica,"Well, you’re making him a frieze salad with goat cheese and pine nuts, wild nuts, wild rice, roast asparagus, and salmon au croup.",neutral,0
1646,123,10,Rachel,I thought I was making him filet mignon?,surprise,1
1647,123,11,Monica,"Yeah, you were, but you decided to make salmon because you had some left over at the restaurant.",neutral,0
1648,123,12,Monica,"And then you realised if you  bitched about it, then you  would stop cooking, and you  would have to make your famous baked potato and Diet Coke.",anger,1
1649,123,13,Rachel,"Wow, I really get crabby when I cook.",surprise,1
1650,124,0,Hypnosis Tape,You are falling fast asleep.,neutral,0
1651,124,1,Hypnosis Tape,Deeper.,neutral,0
1652,124,2,Hypnosis Tape,Deeper.,neutral,0
1653,124,3,Hypnosis Tape,Deeper.,neutral,0
1654,124,4,Hypnosis Tape,You are now completely asleep.,neutral,0
1655,124,5,Hypnosis Tape,You don’t need to smoke.,neutral,0
1656,124,6,Hypnosis Tape,Cigarettes don’t control you.,neutral,0
1657,124,7,Hypnosis Tape,"You are a strong, confident woman, who does not need to smoke.",neutral,1
1658,124,8,Hypnosis Tape,"A strong, confident woman.",neutral,1
1659,125,0,Phoebe,So how are things going with Paul?,neutral,0
1660,125,1,Rachel,Good.,joy,0
1661,125,2,Rachel,"Although y’know, he-he’s a private guy.",neutral,0
1662,125,3,Rachel,"Y’know, I wish I could get him to open up a little bit, share some feelings.",sadness,0
1663,125,4,Phoebe,That’s easy! You just have to think of him as a-as a jar of pickles that won’t open.,neutral,1
1664,125,5,Rachel,So what are you saying.  I should run him under hot water and bang his head against a table?,surprise,0
1665,125,6,Phoebe,No that’s what you do when you want to get the truth out of someone.,neutral,1
1666,125,7,Paul,Hi honey.,neutral,0
1667,125,8,Rachel,Hi!,joy,0
1668,126,0,Gunther,Remind me to review with you which pot is decaf and which is regular.,neutral,1
1669,126,1,Rachel,Can’t I just look at the handles on them?,neutral,0
1670,126,2,Gunther,You would think.,neutral,1
1671,126,3,Rachel,"Okay, fine.",neutral,0
1672,126,4,Rachel,"Gunther, y'know what, I am a terrible waitress, do you know why I’m a terrible waitress?",anger,0
1673,126,5,Rachel,"Because, I don’t care.",neutral,0
1674,126,6,Rachel,I don’t care.,neutral,0
1675,126,7,Rachel,"I don’t care which pot is regular and which pot is decaf, I don’t care where the tray spot is, I just don’t care, this is not what I want to do.",anger,0
1676,126,8,Rachel,So I don’t think I should do it anymore.,sadness,0
1677,126,9,Rachel,I’m gonna give you my weeks notice.,sadness,0
1678,126,10,Gunther,What?!,surprise,0
1679,126,11,Rachel,"Gunther, I quit.",sadness,0
1680,126,12,Chandler,Does this mean we’re gonna have to start paying for coffee?,surprise,1
1681,127,0,Rachel,"Ohh, I mean it’s just so realistic!",joy,0
1682,127,1,Joey,"I know.  Yeah, his name is Pat.",neutral,0
1683,127,2,Rachel,Pat the dog. Oh! Oh! I get it!!,joy,1
1684,127,3,Joey,"Do you uh, do you—ready for a refill?",neutral,0
1685,127,4,Rachel,"Oh, I probably shouldn’t—so I will!  Oh! Wow! It’s like it’s raining!",surprise,1
1686,127,5,Joey,"Pretty cool, huh?",joy,0
1687,127,6,Joey,"But if you’re thinking you can put a fish in there and it wouldn’t get sucked up into the mechanism, well you’d be wrong.",neutral,1
1688,127,7,Rachel,"Umm, can I use your bathroom?",neutral,0
1689,127,8,Joey,"It’s uh, right through there.",neutral,0
1690,127,9,Rachel,"Okay.  God y’know, if someone told me a week ago that I would be peeing in Joey Tribbiani’s apartment",joy,0
1691,127,10,Joey,"Yeah, life’s pretty great isn’t it?",joy,1
1692,128,0,Joey,"You know, I think I was sixteen.",neutral,0
1693,128,1,Monica,"Please, just a little bit off the back.",neutral,0
1694,128,2,Phoebe,"I'm still on ""no.""",neutral,0
1695,128,3,Rachel,"Uh, morning. Do you guys think you could close your eyes for just a sec?",neutral,0
1696,128,4,Joey,"No-no-no-no-no,  I'm not fallin' for that again.",anger,1
1697,128,5,Phoebe,What's goin' on?,neutral,0
1698,128,6,Rachel,"Well, I sorta did a stupid thing last night.",neutral,0
1699,128,7,Chandler,What stupid thing did you do?,neutral,0
1700,128,8,Phoebe,Ewww!,disgust,1
1701,129,0,Chandler,I know.,neutral,0
1702,129,1,Chandler,"See, yes.",neutral,0
1703,129,2,Chandler,"That’s Yasmine Bleeth, she’s a completely different kind of chick.",neutral,0
1704,129,3,Chandler,I love you both.,neutral,1
1705,129,4,Chandler,But in very different ways.,neutral,1
1706,129,5,Joey,Hey!,surprise,0
1707,129,6,Chandler,Hey!,surprise,0
1708,129,7,Chandler,"I did! But the store wouldn’t take her back! So then I took her to the shelter, and you know what I found out?",anger,0
1709,129,8,Chandler,"If they can’t find a home for her, they kill her! And I’m not gonna let that happen to little Yasmine!",anger,0
1710,129,9,Joey,"Okay, good, good, good, ‘cause, good, ‘cause I was kinda having second thoughts too.",fear,0
1711,129,10,Chandler,Okay. And it’s not just chicks y'know? It’s all kinds of other animals!,disgust,0
1712,129,11,Joey,"That’s horrible! Well, you did the right thing man.",disgust,0
1713,129,12,Chandler,"Thanks, I’m glad you see it that way.",joy,0
1714,129,13,Chandler,"Ohhh-hoo, funny story!",joy,0
1715,130,0,Rachel,"So Chandler, have you heard about Monica's secret boyfriend?",neutral,0
1716,130,1,Chandler,"Uhh, yeah. She uh, she uh, she uh might've mentioned him.",neutral,1
1717,130,2,Rachel,"So Mon, when are we gonna meet this new secret waiter man?",neutral,0
1718,130,3,Monica,"Ohh, he's really shy. I-I don’t think he's up to meeting everyone yet.",neutral,0
1719,130,4,Chandler,"Yeah, I don't think he's up to meeting everyone yet.",neutral,1
1720,130,5,Rachel,I don’t care! I wanna meet this guy who's the best sex she ever had!,joy,0
1721,130,6,Chandler,Really?! That's what you heard?  You said that?,surprise,1
1722,130,7,Monica,I might've said that.  Why is that funny?,neutral,0
1723,130,8,Chandler,Because I'm very happy for him!  And,joy,1
1724,130,9,Ross,Hi!,sadness,0
1725,131,0,Rachel,Did you get all this stuff for Joey to try and drive me out of the apartment?,anger,0
1726,131,1,Rachel,"Honey, if you wanted to do that, you might as well just gotten him a fish, you know how fish freaked me out!",disgust,1
1727,131,2,Phoebe,Fish!,surprise,1
1728,131,3,Rachel,"It wouldn't have mattered anyway, Phoebe, you and I are, are gonna live together, we're roommates; that's the deal.",neutral,0
1729,131,4,Phoebe,"Yes, but I wanted you to want to live with me, but okay, if you're having so much fun over here",sadness,0
1730,131,5,Rachel,"Oh, it's so much more fun with you.",joy,0
1731,131,6,Phoebe,"We did have fun, didn't we?",joy,0
1732,131,7,Rachel,We did!,joy,0
1733,131,8,Phoebe,"Oh, anyway, they say, if we want, we can see it tonight.",neutral,0
1734,131,9,Rachel,"Oh, I would love to!",joy,0
1735,131,10,Phoebe,"Yay, okay!",joy,0
1736,131,11,Rachel,"Good, good, good, good, good.",joy,0
1737,131,12,Phoebe,"Great, all right, okay, and Monica ask me to make the drumming stop.",neutral,0
1738,131,13,Rachel,Um...  Done!,neutral,1
1739,132,0,Ross,"Okay, it’s coffee.",neutral,0
1740,132,1,Tommy,Ice coffee? Tell me it’s ice coffee!,surprise,1
1741,132,2,Ross,It’s-it’s hot,neutral,0
1742,132,3,Tommy,Hot coffee!!!,surprise,1
1743,132,4,Tommy,You idiot!!,anger,1
1744,132,5,Tommy,"You were gonna spill hot coffee all over me, huh?!!",anger,0
1745,132,6,Tommy,"What are you just some big, dumb, stupid, doofy idiot, with a doofy idiot hairdo, huh?!",anger,1
1746,132,7,Tommy,Huh?,anger,0
1747,132,8,Rachel,What’s your favourite thing about summertime?,neutral,0
1748,132,9,Monica,"Umm, going to the beach. When it stays light real late.",neutral,0
1749,132,10,Rachel,Yeah,neutral,0
1750,132,11,Tommy,Hey!,surprise,0
1751,132,12,Rachel,"Tommyyyy! Say, what’s your favourite thing about summer?",joy,0
1752,132,13,Tommy,"Ooh, I don’t know. Probably the smell of freshly cut grass.",neutral,0
1753,132,14,Chandler,"Ohh, that’s a good one.",joy,0
1754,133,0,Monica,Is it better than the other salmon mousse?,neutral,0
1755,133,1,Joey,It's creamier.,neutral,0
1756,133,2,Monica,"Yeah, well, is that",neutral,0
1757,133,3,Joey,"I don't know. We're talking about whipped fish, Monica. I'm just happy I'm keeping it down, y'know?",disgust,1
1758,133,4,Rachel,My God! What happened to you?,surprise,0
1759,133,5,Chandler,"Eight and a half hours of aptitude tests, intelligence tests, personality tests... and what do I learn?",disgust,0
1760,133,6,Chandler,"""You are ideally suited for a career in data processing for a large multinational corporation.""",anger,1
1761,133,7,Phoebe,That's so great! 'Cause you already know how to do that!,joy,0
1762,133,8,Chandler,"Can you believe it? I mean, don't I seem like somebody who should be doing something really",anger,0
1763,133,9,Rachel,"Oh Chandler, I know, I know... oh, hey! You can see your nipples through this shirt!",sadness,1
1764,133,10,Monica,"Here you go, maybe this'll cheer you up.",joy,0
1765,133,11,Chandler,"Ooh, you know, I had a grape about five hours ago, so I'd better split this with you.",neutral,0
1766,134,0,Gunther,Someone in there?,neutral,0
1767,134,1,Chandler,No. This is just part of a dare devil game that I play called ‘wait until the last moment before I burst and die.’,anger,1
1768,134,2,Chandler,"Jeez, man did you fall.. Hi! So ah, did ya, did-did-did ya fall high?",surprise,0
1769,134,3,Woman,"Someone was in the lady's room, I couldn’t wait. I left the lid up for ya though.",neutral,0
1770,134,4,Chandler,"Y'know what Gunther, go ah, go ahead, I’m-I’m talking to ah, .  This is the part where you say your name.",neutral,1
1771,134,5,Woman,Ginger.,neutral,0
1772,134,6,Chandler,"Ginger. I’m talking to Ginger, so....",neutral,0
1773,134,7,Ginger,Don’t you have to use the bathroom?,neutral,0
1774,134,8,Chandler,"Nope, nope, I’d just ah, I’d rather talk to you.",neutral,0
1775,134,9,Chandler,"Yes, I do.",neutral,0
1776,134,10,Chandler,"Yes, I do have to go to the bathroom.",neutral,1
1777,134,11,Gunther,Someone in here.,neutral,1
1778,135,0,Dina,"I’m going to keep dating him Mother, and there’s nothing you can do about it!",anger,0
1779,135,1,Jessica Lockhart,Oh yes there is!,anger,0
1780,135,2,Dina,What are you going to do? Kill him? Like you did with Charles?!,anger,0
1781,135,3,Jessica Lockhart,"Oh, my baby!",sadness,1
1782,135,4,Joey,That was a great scene! And-and-and that slap looks so real! How do you do that?,surprise,0
1783,135,5,Cecilia,"Oh, just years of experience.",neutral,0
1784,135,6,Dina,Can I get some ice here?!,sadness,0
1785,135,7,Joey,"Oh anyway, I just wanted to say how wonderful I think you are.",joy,0
1786,135,8,Cecilia,You’re not the fan who’s dying are you?,neutral,1
1787,135,9,Joey,"No. No, I’m Joey Tribbiani; we did a scene together yesterday. I-I’m the guy in the coma!",joy,0
1788,135,10,Cecilia,Oh that was a real person?!,surprise,1
1789,135,11,Joey,"An-an-anyway I-I just wanted to say that since I’m getting your brain when you leave the show, I was wondering if there was any tips you can give me",neutral,0
1790,135,12,Cecilia,I-I-I’m leaving the show?,surprise,0
1791,135,13,Joey,I don’t know. Why? Did you hear something?,neutral,1
1792,135,14,Cecilia,Who told you that?,surprise,0
1793,135,15,Joey,"Oh uh, one of the writers.",sadness,0
1794,135,16,Cecilia,Which one? Was it bald or was it tall?,surprise,0
1795,136,0,Phoebe,Feel better?,neutral,0
1796,136,1,Joey,Yeah!,joy,0
1797,136,2,Joey,Much!,joy,0
1798,136,3,Joey,"Listen uh, not that I’m y’know insecure about my manhood or anything y’know, but I think I need to hook up with a woman like right now.",neutral,0
1799,136,4,Phoebe,"Yeah, I understand.",neutral,0
1800,136,5,Joey,Yeah! Okay!  Hey! Hi!,joy,0
1801,136,6,Woman,Hi!,joy,0
1802,136,7,Joey,"Y’know, you look familiar. Do I know you from somewhere?",surprise,0
1803,136,8,Woman,I don’t think so.,neutral,0
1804,136,9,Joey,Oh! Maybe it’s because I’m on television. I’m an actor on,joy,1
1805,136,10,Woman,Wow!,surprise,0
1806,136,11,Joey,Yeah.,neutral,0
1807,136,12,Woman,Really?!,surprise,0
1808,136,13,Waitress,$4.50 please.,neutral,0
1809,136,14,Joey,"Oh, let me get this.    These are for you.",neutral,1
1810,137,0,Chandler,"Alright, alright, alright.",neutral,0
1811,137,1,Chandler,It's been fourteen and a half minutes and you still have not said one word.,anger,0
1812,137,2,Chandler,"Oh God, do something.",anger,0
1813,137,3,Chandler,"Just make contact, smile!",anger,0
1814,137,4,Chandler,There you go!,joy,0
1815,137,5,Chandler,You're definitely scaring here.,neutral,1
1816,137,6,Jill,Would you like to call somebody?,neutral,0
1817,137,7,Chandler,"Yeah, about 300 guys I went to high school with.",neutral,1
1818,138,0,Ross,"Phoebe, she doesn’t know that you sneak out every night, she doesn’t know that you sneak back every morning, and she doesn’t know that you’ve been living with your Grandmother’s for a week now.",neutral,0
1819,138,1,Phoebe,"Okay, well maybe not on those levels.",neutral,1
1820,138,2,Chandler,Hey.,neutral,0
1821,138,3,Ross,Hey.,neutral,0
1822,138,4,Chandler,"I’m never gonna find a roommate, ever.",sadness,0
1823,138,5,Phoebe,"Why, nobody good?",neutral,0
1824,138,6,Chandler,"Well let’s see, there was the guy with the ferrets, that’s plural.",disgust,1
